{
  "name": "acme-demo",
  "base": "default",
  "palette": {
    "primary": "#6C3FC5",
    "secondary": "#9B6DDB",
    "background": "#FFFFFF",
    "surface": "#F3EFFC",
    "border": "#C4B0E8",
    "text": "#1A1035",
    "textMuted": "#5C4A80",
    "success": "#2ECC71",
    "warning": "#F39C12",
    "error": "#E74C3C"
  },
  "typography": {
    "fontFamily": "Inter, system-ui, -apple-system, sans-serif",
    "monoFamily": "JetBrains Mono, Fira Code, monospace",
    "baseFontSize": 14,
    "titleFontSize": 18,
    "smallFontSize": 11,
    "lineHeight": 1.4
  },
  "spacing": {
    "unit": 8,
    "nodePadding": 12,
    "nodeGap": 40,
    "diagramMargin": 24
  },
  "edges": {
    "strokeWidth": 1.5,
    "arrowSize": 8,
    "labelFontSize": 12,
    "curveTension": 0.25
  }
}
